{
  "version": "1.0.0",
  "observed_at": "2026-10-26",
  "control_plane": {
    "repository": "MelodicBloom/.github",
    "baseline_sha": "957198fb890ad424af8dea469873e903a886fd48",
    "branch": "docs/canonical-repository-registry-v1"
  },
  "repositories": [
    {
      "full_name": "MelodicBloom/.github",
      "canonical_status": "canonical",
      "lifecycle": "governance",
      "owner": "MelodicBloom",
      "default_branch": "main",
      "observed_sha": "957198fb890ad424af8dea469873e903a886fd48",
      "runtime": {
        "kind": "documentation",
        "package_manager": "none",
        "lockfile": null,
        "contract": "Organization automation control plane; phase-1 registry validator applies the JSON Schema via Ajv (npm devDependency) plus hand-written checks."
      },
      "deployment": {
        "disposition": "none",
        "authority": "GitHub repository and reusable Actions; no Vercel product runtime required.",
        "vercel_project_id": null,
        "vercel_project_name": null
      },
      "runtime_access": {
        "vercel_connect": "disabled",
        "github_permission_profile": "none",
        "notes": "This repository defines policy; it should not need delegated runtime GitHub credentials."
      },
      "relationships": [],
      "documentation": "README.md; docs/repositories/CODEX_HANDOFF.md",
      "upstream_sync": "Canonical organization control plane; no upstream mirror policy.",
      "uncertainties": [
        "Issue #5 named 51d2de7 as the original baseline; current main advanced to 957198f before this branch was created.",
        "2026-10-26: origin/main still 957198f; no rebase needed. Repo CI (control-plane-qa.yml) pins Node 24 while the handoff targets Node >=22 for the validator."
      ],
      "provenance": {
        "repository_url": "https://github.com/MelodicBloom/.github",
        "commit_url": "https://github.com/MelodicBloom/.github/commit/957198fb890ad424af8dea469873e903a886fd48",
        "observed_at": "2026-10-26"
      }
    },
    {
      "full_name": "MelodicBloom/agent-runtime-control-center",
      "canonical_status": "canonical",
      "lifecycle": "governance",
      "owner": "MelodicBloom",
      "default_branch": "main",
      "observed_sha": "4c74f1e1bd2e0e68f5ee835380c7ef69d14137ff",
      "runtime": {
        "kind": "node",
        "package_manager": "pnpm",
        "lockfile": "pnpm-lock.yaml",
        "contract": "Root pnpm-lock.yaml + portfolio-registry.yml (pnpm/action-setup, Node 24). package.json declares no engines/packageManager."
      },
      "deployment": {
        "disposition": "unknown",
        "authority": "No deployment authority asserted in phase 1 without direct Vercel evidence.",
        "vercel_project_id": null,
        "vercel_project_name": null
      },
      "runtime_access": {
        "vercel_connect": "disabled",
        "github_permission_profile": "review-agent",
        "notes": "Phase 1 decision #3: no runtime GitHub action has been proven, so Vercel Connect stays disabled. Profile review-agent is a classification of possible future need only; no install authorized."
      },
      "relationships": [
        {
          "type": "governed-by",
          "target": "MelodicBloom/.github"
        }
      ],
      "documentation": "README.md",
      "upstream_sync": "No upstream policy asserted in phase 1.",
      "uncertainties": [
        "2026-10-26: read-only-audit.yml runs `npm ci` on Node 22 while root lockfile is pnpm-lock.yaml (no package-lock.json at root); package-manager evidence conflicts across workflows.",
        "2026-10-26: Node runtime unresolved (CI uses 22 and 24; no engines field).",
        "2026-10-26: vercel.json exists but Vercel list_projects repoUrl filter in team melodicbloom returned no linked project; deployment stays unknown."
      ],
      "provenance": {
        "repository_url": "https://github.com/MelodicBloom/agent-runtime-control-center",
        "commit_url": "https://github.com/MelodicBloom/agent-runtime-control-center/commit/4c74f1e1bd2e0e68f5ee835380c7ef69d14137ff",
        "observed_at": "2026-10-26"
      }
    },
    {
      "full_name": "MelodicBloom/aether",
      "canonical_status": "candidate",
      "lifecycle": "candidate",
      "owner": "MelodicBloom",
      "default_branch": "main",
      "observed_sha": "dd45f60dd6c9195a9c29a2c311bf4cfab7705716",
      "runtime": {
        "kind": "node",
        "package_manager": "npm",
        "lockfile": "package-lock.json",
        "contract": "Next.js app; root package-lock.json and `npm ci` in CI. No engines field; CI uses Node 22 (reproducible-build.yml) and Node 20 (verify-aether-v0.yml)."
      },
      "deployment": {
        "disposition": "unknown",
        "authority": "Deployment mapping intentionally left unresolved in phase 1.",
        "vercel_project_id": null,
        "vercel_project_name": null
      },
      "runtime_access": {
        "vercel_connect": "disabled",
        "github_permission_profile": "none",
        "notes": "No delegated GitHub runtime access justified by current evidence."
      },
      "relationships": [
        {
          "type": "related",
          "target": "qt314wink/aether"
        }
      ],
      "documentation": "README.md",
      "upstream_sync": "Relationship to qt314wink/aether requires explicit uniqueness/supersession review.",
      "uncertainties": [
        "Canonical relationship to qt314wink/aether is not yet decided.",
        "2026-10-26: Node major unresolved (CI 20 vs 22, no engines).",
        "2026-10-26: Vercel project aether-specimen (prj_TrnX6XVbmT7CUcVusRJSvFpS643x, created 2026-10-26 11:35 EDT) is Git-linked to this repo per list_projects repoUrl filter; production target/purpose not proven, so disposition remains unknown and project is not recorded as authority."
      ],
      "provenance": {
        "repository_url": "https://github.com/MelodicBloom/aether",
        "commit_url": "https://github.com/MelodicBloom/aether/commit/dd45f60dd6c9195a9c29a2c311bf4cfab7705716",
        "observed_at": "2026-10-26"
      },
      "authority_facets": [
        {
          "domain": "fixture_test_domain",
          "role": "canonical",
          "confidence": "provisional",
          "scope": [
            "fixture_scope"
          ],
          "basis": [
            "fixture_only"
          ],
          "review_triggers": [
            "second_repo_claiming_same_authority"
          ]
        }
      ]
    },
    {
      "full_name": "MelodicBloom/chromaflora-prime",
      "canonical_status": "canonical",
      "lifecycle": "production",
      "owner": "MelodicBloom",
      "default_branch": "main",
      "observed_sha": "eb81c6b7db77597d2ac1302c40173bfe83a97bdd",
      "runtime": {
        "kind": "node",
        "package_manager": "npm",
        "lockfile": "package-lock.json",
        "contract": "npm via root package-lock.json; package.json engines node>=18.17.0, npm>=9.0.0; CI pins Node 20; Vercel project nodeVersion 24.x."
      },
      "deployment": {
        "disposition": "vercel-production",
        "authority": "Vercel team melodicbloom project mapping observed on 2026-09-20.",
        "vercel_project_id": "prj_ZufiixUV8BlWUNPplKwEnXMOIuhl",
        "vercel_project_name": "chromaflora-prime"
      },
      "runtime_access": {
        "vercel_connect": "disabled",
        "github_permission_profile": "none",
        "notes": "Visual/product runtime should use ordinary Git integration unless a concrete agent feature needs GitHub API access."
      },
      "relationships": [],
      "documentation": "README.md",
      "upstream_sync": "No upstream mirror policy asserted in phase 1.",
      "uncertainties": [
        "2026-10-26: Vercel project chromaflora-prime is Git-linked under the pre-transfer path qt314wink/chromaflora-prime (GitHub redirects to MelodicBloom/chromaflora-prime, same repo id 1261976307); repoUrl filter for MelodicBloom path returns nothing.",
        "2026-10-26: latest production deployment dpl_44Vp7yKBFVKiW389S3zgTBJGgRqN is in ERROR state (2026-06-25 09:56 EDT); disposition kept as vercel-production per mapping but production health is unproven.",
        "2026-10-26: Node contract conflicts (engines >=18.17, CI 20, Vercel 24.x)."
      ],
      "provenance": {
        "repository_url": "https://github.com/MelodicBloom/chromaflora-prime",
        "commit_url": "https://github.com/MelodicBloom/chromaflora-prime/commit/eb81c6b7db77597d2ac1302c40173bfe83a97bdd",
        "observed_at": "2026-10-26"
      }
    },
    {
      "full_name": "MelodicBloom/nacre-orchid",
      "canonical_status": "candidate",
      "lifecycle": "candidate",
      "owner": "MelodicBloom",
      "default_branch": "main",
      "observed_sha": "e264e1cb86357c6f8718f0bc5cd5705ebe7209f1",
      "runtime": {
        "kind": "documentation",
        "package_manager": "none",
        "lockfile": null,
        "contract": "Root tree at e264e1c contains only README.md, docs/, schemas/, skills/; no package metadata or lockfile."
      },
      "deployment": {
        "disposition": "unknown",
        "authority": "No deployment authority asserted in phase 1.",
        "vercel_project_id": null,
        "vercel_project_name": null
      },
      "runtime_access": {
        "vercel_connect": "disabled",
        "github_permission_profile": "none",
        "notes": "Keep runtime authority off until a GitHub-calling agent feature exists."
      },
      "relationships": [],
      "documentation": "README.md",
      "upstream_sync": "No upstream policy asserted in phase 1.",
      "uncertainties": [
        "2026-10-26: package_manager=none inferred from absence of any package metadata/lockfile at root; nested manifests not exhaustively searched.",
        "Deployment mapping not proven; no Vercel lookup by repo performed beyond registry-named projects."
      ],
      "provenance": {
        "repository_url": "https://github.com/MelodicBloom/nacre-orchid",